{
  "$schema": "https://tools.gallery.any.coop/experience.schema.json",
  "id": "42e81ea8-021f-4426-91b6-0a2a46866bc8",
  "name": "para_tasks_resources_meeting_notes_crm",
  "author": "https://github.com/ChristianHaake",
  "license": "MIT",
  "title": "PARA / Tasks / Resources / Meeting notes / CRM",
  "description": "Here is my fully integrated space. Where I embrace the PARA Methodology. This Space includes the following aspects:\n\n- PARA\r\n- Meeting notes \r\n- CRM\r\n- Library \r\n- Wiki\r\n- Tasks and Projects\n\nFor in detail explanation, check out my articles:\r\n- https://haak3.de/articles/2023_Anytype/2023_Anytype-Dashboard/2023_Anytype-Dashboard-EN.html\r\n- https://haak3.de/articles/2023_Anytype/2023_Anytype-Meetingnotes/2023_Antype-Meetingnotes-EN.html\r\n- https://haak3.de/articles/2023_Anytype/2023_Mein-PKM_mit-CODE/2023_MY-PKM-with-Code.html\r\n- https://haak3.de/articles/2023_Anytype/2023_Anytype-mit-PARA/2023_Using-PARA-with-Anytype-EN.html",
  "categories": [
    "Dashboard",
    "Work",
    "Education",
    "Project tracking",
    "Hobbies"
  ],
  "language": "en-US",
  "screenshots": [
    "https://github.com/anyproto/gallery/raw/para_tasks_resources_meeting_notes_crm/experiences/para_tasks_resources_meeting_notes_crm/screenshots/screenshot-1.png",
    "https://github.com/anyproto/gallery/raw/para_tasks_resources_meeting_notes_crm/experiences/para_tasks_resources_meeting_notes_crm/screenshots/screenshot-2.png",
    "https://github.com/anyproto/gallery/raw/para_tasks_resources_meeting_notes_crm/experiences/para_tasks_resources_meeting_notes_crm/screenshots/screenshot-3.png",
    "https://github.com/anyproto/gallery/raw/para_tasks_resources_meeting_notes_crm/experiences/para_tasks_resources_meeting_notes_crm/screenshots/screenshot-4.png",
    "https://github.com/anyproto/gallery/raw/para_tasks_resources_meeting_notes_crm/experiences/para_tasks_resources_meeting_notes_crm/screenshots/screenshot-5.png"
  ],
  "downloadLink": "https://github.com/anyproto/gallery/raw/para_tasks_resources_meeting_notes_crm/experiences/para_tasks_resources_meeting_notes_crm/para_tasks_resources_meeting_notes_crm.zip",
  "fileSize": 8068542
}
